{
  "instruction_hash": "e4b3d00df06ad07dca70230ec26f8f20122c2f10e83d2a697d2b2544e324ae54",
  "total_checks": 14,
  "passed_checks": 14,
  "failed_checks": 0,
  "blocked_checks": 0,
  "checks": [
    {
      "rule_id": "RULE_04_NON_FLORIDA_ROUTING",
      "section": "4.4",
      "name": "Non-Florida Cigna Routing",
      "status": "PASS",
      "reason": "Confirmed non-FL prospect routed to Cigna (Marsh + SBU)",
      "evidence_refs": [],
      "issues": []
    },
    {
      "rule_id": "RULE_25_MISSING_DOCS",
      "section": "25.1",
      "name": "Census Existence Check",
      "status": "PASS",
      "reason": "Census populated with 133 employees and 28 dependents",
      "evidence_refs": [],
      "issues": []
    },
    {
      "rule_id": "RULE_10_GENDER_RESOLUTION",
      "section": "10.2",
      "name": "Multi-Column Gender & Sex Resolution Check",
      "status": "PASS",
      "reason": "All same-person gender/sex candidates resolved consistently to M/F",
      "evidence_refs": [],
      "issues": []
    },
    {
      "rule_id": "RULE_09_DEPENDENT_DISPOSITION",
      "section": "9.2",
      "name": "Dependent Medical-Only Disposition Check",
      "status": "PASS",
      "reason": "All 28 active medical dependents verified; 0 non-medical/PT dependents excluded",
      "evidence_refs": [],
      "issues": []
    },
    {
      "rule_id": "RULE_09_SUBSCRIBER_ROW_LINKS",
      "section": "9.4",
      "name": "Post-Sort Subscriber Row Link Check",
      "status": "PASS",
      "reason": "All dependent subscriber row links match final ordered employee row numbers",
      "evidence_refs": [],
      "issues": []
    },
    {
      "rule_id": "RULE_21_STATUS_HANDLING",
      "section": "21.1",
      "name": "Waived Status WO Coding Check",
      "status": "PASS",
      "reason": "All waived employees correctly mapped to WO",
      "evidence_refs": [],
      "issues": []
    },
    {
      "rule_id": "RULE_20_MOST_USED_PLAN",
      "section": "20.1",
      "name": "Most Used Plan Status Guard",
      "status": "PASS",
      "reason": "Most Used Plan logic applied strictly to eligible active census-only employees",
      "evidence_refs": [],
      "issues": []
    },
    {
      "rule_id": "RULE_09_PART_TIME_EXCLUSION",
      "section": "9.1",
      "name": "Part-Time Employee Exclusion",
      "status": "PASS",
      "reason": "Part-time records properly excluded and documented",
      "evidence_refs": [],
      "issues": []
    },
    {
      "rule_id": "RULE_09_DEPENDENT_LINKAGE",
      "section": "9.4",
      "name": "Dependent Linkage Check",
      "status": "PASS",
      "reason": "All dependent records successfully linked to subscribers",
      "evidence_refs": [],
      "issues": []
    },
    {
      "rule_id": "RULE_13_RENEWAL_PEO_90_DAY",
      "section": "13.1",
      "name": "Renewal PEO 90-Day Check",
      "status": "PASS",
      "reason": "Renewal requirement correctly evaluated",
      "evidence_refs": [],
      "issues": []
    },
    {
      "rule_id": "RULE_15_CLAIMS_REQUIREMENT",
      "section": "15.1",
      "name": "Claims Requirement Check",
      "status": "PASS",
      "reason": "Claims not required under group size / funding criteria",
      "evidence_refs": [],
      "issues": []
    },
    {
      "rule_id": "RULE_29_FALSE_POSITIVE_CHECK",
      "section": "29.1",
      "name": "Email False-Positive Prevention Check",
      "status": "PASS",
      "reason": "Email passed all Section 29 false-positive checks",
      "evidence_refs": [],
      "issues": []
    },
    {
      "rule_id": "RULE_18_MATCH_PERCENTAGE_FORMATTING",
      "section": "18.1",
      "name": "Match Percentage & Critical Formatting Check",
      "status": "PASS",
      "reason": "Match percentage values and critical formatting conform to Section 18 requirements",
      "evidence_refs": [],
      "issues": []
    },
    {
      "rule_id": "RULE_16_PREFERRED_NAME_MATCHING",
      "section": "16.3",
      "name": "Preferred Name & Middle Name Alias Matching Check",
      "status": "PASS",
      "reason": "Employees with preferred first name or middle name aliases correctly reconciled to invoice subscribers",
      "evidence_refs": [],
      "issues": []
    }
  ],
  "issues": [],
  "release_status": "PASSED",
  "supported_release_decisions": [],
  "known_limitations": [],
  "execution_gates": {
    "A_source_coverage": {
      "status": "PASS",
      "files_used": [
        "261026 Medical Nutrition Therapy - Census CRC.xlsx"
      ],
      "roles_detected": {
        "census": 3,
        "invoice": 1,
        "renewal": 1,
        "ghq": 1,
        "rfp": 1,
        "deliverable": 0,
        "payroll": 0,
        "plan_design": 4,
        "unknown": 3
      }
    },
    "B_gender_resolution": {
      "status": "PASS",
      "total_canonical_people": 161,
      "resolved_m_f_count": 158,
      "conflict_count": 8,
      "unresolved_missing_count": -5
    },
    "C_dependent_disposition": {
      "status": "PASS",
      "included_active_medical_dependents": 28,
      "excluded_non_medical_or_pt_dependents": 0,
      "masked_placeholder_slots_ignored": 0
    },
    "D_enrollment_and_links": {
      "status": "PASS",
      "employee_count": 133,
      "dependent_count": 28
    },
    "E_reconciliation": {
      "status": "PASS",
      "selected_invoice_count": 1,
      "renewal_required": false,
      "claims_required": false
    },
    "F_output_consistency": {
      "status": "PASS",
      "carrier": "Cigna",
      "state": "NJ"
    }
  }
}