{
  "instruction_hash": "e4b3d00df06ad07dca70230ec26f8f20122c2f10e83d2a697d2b2544e324ae54",
  "total_checks": 20,
  "passed_checks": 19,
  "failed_checks": 1,
  "blocked_checks": 0,
  "checks": [
    {
      "rule_id": "RULE_04_FLORIDA_ROUTING",
      "section": "4.3",
      "name": "Florida Blue Carrier Routing",
      "status": "PASS",
      "reason": "Florida prospect correctly routed to Florida Blue (RAPT template)",
      "evidence_refs": [],
      "issues": []
    },
    {
      "rule_id": "RULE_07_GHQ_FLORIDA",
      "section": "7.1",
      "name": "Florida GHQ Requirement",
      "status": "PASS",
      "reason": "GHQ provided for Florida Blue prospect",
      "evidence_refs": [],
      "issues": []
    },
    {
      "rule_id": "RULE_25_MISSING_DOCS",
      "section": "25.1",
      "name": "Census Existence Check",
      "status": "PASS",
      "reason": "Census populated with 142 employees and 19 dependents",
      "evidence_refs": [],
      "issues": []
    },
    {
      "rule_id": "RULE_10_GENDER_RESOLUTION",
      "section": "10.2",
      "name": "Multi-Column Gender & Sex Resolution Check",
      "status": "PASS",
      "reason": "All same-person gender/sex candidates resolved consistently to M/F",
      "evidence_refs": [],
      "issues": []
    },
    {
      "rule_id": "RULE_09_DEPENDENT_DISPOSITION",
      "section": "9.2",
      "name": "Dependent Medical-Only Disposition Check",
      "status": "PASS",
      "reason": "All 19 active medical dependents verified; 20 non-medical/PT dependents excluded",
      "evidence_refs": [],
      "issues": []
    },
    {
      "rule_id": "RULE_09_SUBSCRIBER_ROW_LINKS",
      "section": "9.4",
      "name": "Post-Sort Subscriber Row Link Check",
      "status": "PASS",
      "reason": "All dependent subscriber row links match final ordered employee row numbers",
      "evidence_refs": [],
      "issues": []
    },
    {
      "rule_id": "RULE_21_STATUS_HANDLING",
      "section": "21.1",
      "name": "Waived Status WO Coding Check",
      "status": "PASS",
      "reason": "All waived employees correctly mapped to WO",
      "evidence_refs": [],
      "issues": []
    },
    {
      "rule_id": "RULE_20_MOST_USED_PLAN",
      "section": "20.1",
      "name": "Most Used Plan Status Guard",
      "status": "PASS",
      "reason": "Most Used Plan logic applied strictly to eligible active census-only employees",
      "evidence_refs": [],
      "issues": []
    },
    {
      "rule_id": "RULE_09_PART_TIME_EXCLUSION",
      "section": "9.1",
      "name": "Part-Time Employee Exclusion",
      "status": "PASS",
      "reason": "Part-time records properly excluded and documented",
      "evidence_refs": [],
      "issues": []
    },
    {
      "rule_id": "RULE_09_DEPENDENT_LINKAGE",
      "section": "9.4",
      "name": "Dependent Linkage Check",
      "status": "PASS",
      "reason": "All dependent records successfully linked to subscribers",
      "evidence_refs": [],
      "issues": []
    },
    {
      "rule_id": "RULE_13_RENEWAL_PEO_90_DAY",
      "section": "13.1",
      "name": "Renewal PEO 90-Day Check",
      "status": "PASS",
      "reason": "Renewal requirement correctly evaluated",
      "evidence_refs": [],
      "issues": []
    },
    {
      "rule_id": "RULE_15_CLAIMS_REQUIREMENT",
      "section": "15.1",
      "name": "Claims Requirement Check",
      "status": "PASS",
      "reason": "Claims not required under group size / funding criteria",
      "evidence_refs": [],
      "issues": []
    },
    {
      "rule_id": "RULE_29_FALSE_POSITIVE_CHECK",
      "section": "29.1",
      "name": "Email False-Positive Prevention Check",
      "status": "PASS",
      "reason": "Email passed all Section 29 false-positive checks",
      "evidence_refs": [],
      "issues": []
    },
    {
      "rule_id": "RULE_18_MATCH_PERCENTAGE_FORMATTING",
      "section": "18.1",
      "name": "Match Percentage & Critical Formatting Check",
      "status": "PASS",
      "reason": "Match percentage values and critical formatting conform to Section 18 requirements",
      "evidence_refs": [],
      "issues": []
    },
    {
      "rule_id": "RULE_16_PREFERRED_NAME_MATCHING",
      "section": "16.3",
      "name": "Preferred Name & Middle Name Alias Matching Check",
      "status": "PASS",
      "reason": "Employees with preferred first name or middle name aliases correctly reconciled to invoice subscribers",
      "evidence_refs": [],
      "issues": []
    },
    {
      "rule_id": "RULE_08_EXAMPLE_ROWS_FILTERED",
      "section": "8.1",
      "name": "Template Example Rows Filtration Check",
      "status": "PASS",
      "reason": "All template example rows successfully filtered from canonical population",
      "evidence_refs": [],
      "issues": []
    },
    {
      "rule_id": "RULE_09_HSA_MEDICAL_PLAN_DISPOSITION",
      "section": "9.2",
      "name": "HSA Medical Plan Classification Check",
      "status": "PASS",
      "reason": "HSA-compatible medical plans correctly classified as medical and retained",
      "evidence_refs": [],
      "issues": []
    },
    {
      "rule_id": "RULE_29_INVOICE_PRESENCE_FALSE_POSITIVE",
      "section": "29.1",
      "name": "Invoice Presence False-Positive Prevention Check",
      "status": "FAIL",
      "reason": "False-positive missing invoice employees detected: [\"Angelina Bencivenga appears in invoice text but marked 'Not On Invoice'\", \"Ernesto Diaz appears in invoice text but marked 'Not On Invoice'\"]",
      "evidence_refs": [],
      "issues": []
    },
    {
      "rule_id": "RULE_23_SUMMARY_PLAN_TABLE_COMPLETENESS",
      "section": "23.3",
      "name": "Summary Plan Table Completeness Check",
      "status": "PASS",
      "reason": "Summary plan-level tables completely account for all active medical plans on invoice",
      "evidence_refs": [],
      "issues": []
    },
    {
      "rule_id": "RULE_26_INVOICE_EXTRACTION_FIDELITY",
      "section": "5.1",
      "name": "Invoice Extraction Fidelity & Collapse Guard",
      "status": "PASS",
      "reason": "Invoice extraction yielded plausible subscriber count relative to document volume",
      "evidence_refs": [],
      "issues": []
    }
  ],
  "issues": [
    {
      "issue_id": "ISSUE_INVOICE_PRESENCE_FALSE_POSITIVE",
      "rule_id": "RULE_29_INVOICE_PRESENCE_FALSE_POSITIVE",
      "target_ref": "comparison.findings.missing_invoice",
      "issue_type": "INVOICE_PRESENCE_FALSE_POSITIVE",
      "severity": "CRITICAL",
      "earliest_stage": "COMPARISON",
      "expected_state": "Employees present in invoice text must not be flagged as missing from invoice",
      "observed_state": "Flagged missing but present in text: [\"Angelina Bencivenga appears in invoice text but marked 'Not On Invoice'\", \"Ernesto Diaz appears in invoice text but marked 'Not On Invoice'\"]",
      "evidence_refs": [],
      "cause_status": "confirmed",
      "allowed_actions": [
        "RECONCILE_INVOICE_PRESENCE"
      ],
      "resolution_status": "open"
    }
  ],
  "release_status": "NEEDS_SOURCE_INFORMATION",
  "supported_release_decisions": [],
  "known_limitations": [],
  "execution_gates": {
    "A_source_coverage": {
      "status": "PASS",
      "files_used": [
        "Employee Census + Dependents_RBI_MTG.xlsx",
        "Employee Census 09.24.2026.xlsx",
        "RBI Census 2026.xlsx"
      ],
      "roles_detected": {
        "census": 3,
        "invoice": 6,
        "renewal": 0,
        "ghq": 1,
        "rfp": 1,
        "deliverable": 0,
        "payroll": 0,
        "plan_design": 3,
        "unknown": 0
      }
    },
    "B_gender_resolution": {
      "status": "PASS",
      "total_canonical_people": 158,
      "resolved_m_f_count": 157,
      "conflict_count": 0,
      "unresolved_missing_count": 1
    },
    "C_dependent_disposition": {
      "status": "PASS",
      "included_active_medical_dependents": 19,
      "excluded_non_medical_or_pt_dependents": 20,
      "masked_placeholder_slots_ignored": 545
    },
    "D_enrollment_and_links": {
      "status": "PASS",
      "employee_count": 139,
      "dependent_count": 19
    },
    "E_reconciliation": {
      "status": "PASS",
      "selected_invoice_count": 6,
      "renewal_required": false,
      "claims_required": false
    },
    "F_output_consistency": {
      "status": "PASS",
      "carrier": "Florida Blue",
      "state": "FL"
    }
  }
}