{
  "instruction_hash": "e4b3d00df06ad07dca70230ec26f8f20122c2f10e83d2a697d2b2544e324ae54",
  "total_checks": 13,
  "passed_checks": 12,
  "failed_checks": 1,
  "blocked_checks": 0,
  "checks": [
    {
      "rule_id": "RULE_04_FLORIDA_ROUTING",
      "section": "4.3",
      "name": "Florida Blue Carrier Routing",
      "status": "PASS",
      "reason": "Florida prospect correctly routed to Florida Blue (RAPT template)",
      "evidence_refs": [],
      "issues": []
    },
    {
      "rule_id": "RULE_07_GHQ_FLORIDA",
      "section": "7.1",
      "name": "Florida GHQ Requirement",
      "status": "PASS",
      "reason": "GHQ provided for Florida Blue prospect",
      "evidence_refs": [],
      "issues": []
    },
    {
      "rule_id": "RULE_25_MISSING_DOCS",
      "section": "25.1",
      "name": "Census Existence Check",
      "status": "PASS",
      "reason": "Census populated with 16 employees and 31 dependents",
      "evidence_refs": [],
      "issues": []
    },
    {
      "rule_id": "RULE_10_GENDER_RESOLUTION",
      "section": "10.2",
      "name": "Multi-Column Gender & Sex Resolution Check",
      "status": "PASS",
      "reason": "All same-person gender/sex candidates resolved consistently to M/F",
      "evidence_refs": [],
      "issues": []
    },
    {
      "rule_id": "RULE_09_DEPENDENT_DISPOSITION",
      "section": "9.2",
      "name": "Dependent Medical-Only Disposition Check",
      "status": "PASS",
      "reason": "All 31 active medical dependents verified; 0 non-medical/PT dependents excluded",
      "evidence_refs": [],
      "issues": []
    },
    {
      "rule_id": "RULE_09_SUBSCRIBER_ROW_LINKS",
      "section": "9.4",
      "name": "Post-Sort Subscriber Row Link Check",
      "status": "PASS",
      "reason": "All dependent subscriber row links match final ordered employee row numbers",
      "evidence_refs": [],
      "issues": []
    },
    {
      "rule_id": "RULE_21_STATUS_HANDLING",
      "section": "21.1",
      "name": "Waived Status WO Coding Check",
      "status": "PASS",
      "reason": "All waived employees correctly mapped to WO",
      "evidence_refs": [],
      "issues": []
    },
    {
      "rule_id": "RULE_20_MOST_USED_PLAN",
      "section": "20.1",
      "name": "Most Used Plan Status Guard",
      "status": "PASS",
      "reason": "Most Used Plan logic applied strictly to eligible active census-only employees",
      "evidence_refs": [],
      "issues": []
    },
    {
      "rule_id": "RULE_09_PART_TIME_EXCLUSION",
      "section": "9.1",
      "name": "Part-Time Employee Exclusion",
      "status": "PASS",
      "reason": "Part-time records properly excluded and documented",
      "evidence_refs": [],
      "issues": []
    },
    {
      "rule_id": "RULE_09_DEPENDENT_LINKAGE",
      "section": "9.4",
      "name": "Dependent Linkage Check",
      "status": "PASS",
      "reason": "All dependent records successfully linked to subscribers",
      "evidence_refs": [],
      "issues": []
    },
    {
      "rule_id": "RULE_13_RENEWAL_PEO_90_DAY",
      "section": "13.1",
      "name": "Renewal PEO 90-Day Check",
      "status": "FAIL",
      "reason": "Renewal is required under PEO 90-day rule but was not provided",
      "evidence_refs": [],
      "issues": []
    },
    {
      "rule_id": "RULE_15_CLAIMS_REQUIREMENT",
      "section": "15.1",
      "name": "Claims Requirement Check",
      "status": "PASS",
      "reason": "Claims not required under group size / funding criteria",
      "evidence_refs": [],
      "issues": []
    },
    {
      "rule_id": "RULE_29_FALSE_POSITIVE_CHECK",
      "section": "29.1",
      "name": "Email False-Positive Prevention Check",
      "status": "PASS",
      "reason": "Email passed all Section 29 false-positive checks",
      "evidence_refs": [],
      "issues": []
    }
  ],
  "issues": [
    {
      "issue_id": "ISSUE_MISSING_REQUIRED_RENEWAL",
      "rule_id": "RULE_13_RENEWAL_PEO_90_DAY",
      "target_ref": "renewal",
      "issue_type": "SOURCE_NOT_PROVIDED",
      "severity": "WARNING",
      "earliest_stage": "EXTRACTION",
      "expected_state": "Renewal document required",
      "observed_state": "Renewal not provided",
      "evidence_refs": [],
      "cause_status": "confirmed",
      "allowed_actions": [],
      "resolution_status": "open"
    }
  ],
  "release_status": "NEEDS_SOURCE_INFORMATION",
  "supported_release_decisions": [],
  "known_limitations": [],
  "execution_gates": {
    "A_source_coverage": {
      "status": "PASS",
      "files_used": [
        "261026 Fourier Health - Rippling Employee Census Report w Dependents.xlsx"
      ],
      "roles_detected": {
        "census": 1,
        "invoice": 1,
        "renewal": 1,
        "ghq": 1,
        "rfp": 1,
        "deliverable": 0,
        "payroll": 0,
        "plan_design": 0,
        "unknown": 0
      }
    },
    "B_gender_resolution": {
      "status": "PASS",
      "total_canonical_people": 46,
      "resolved_m_f_count": 46,
      "conflict_count": 0,
      "unresolved_missing_count": 0
    },
    "C_dependent_disposition": {
      "status": "PASS",
      "included_active_medical_dependents": 31,
      "excluded_non_medical_or_pt_dependents": 0,
      "masked_placeholder_slots_ignored": 0
    },
    "D_enrollment_and_links": {
      "status": "PASS",
      "employee_count": 15,
      "dependent_count": 31
    },
    "E_reconciliation": {
      "status": "FAIL",
      "selected_invoice_count": 1,
      "renewal_required": true,
      "claims_required": false
    },
    "F_output_consistency": {
      "status": "PASS",
      "carrier": "Florida Blue",
      "state": "FL"
    }
  }
}